id,fecha,medio,titulo,url
79,2026-03-02T17:44:39.045159,Infobae,El día en que el Vía Crucis salió de las calles y el clero tocó fondo en Nicaragua,https://www.infobae.com/nicaragua/2026/03/02/el-dia-en-que-el-via-crucis-salio-de-las-calles-y-el-clero-toco-fondo-en-nicaragua/
78,2026-03-02T14:12:52.263990,La Nación,Mendoza: el avance libertario activó la carrera para la gobernación en 2027 y abrió interrogantes en la UCR y el PJ,https://www.lanacion.com.ar/politica/mendoza-el-avance-libertario-activo-la-carrera-para-la-gobernacion-en-2027-y-abrio-interrogantes-en-nid02032026/
77,2026-03-02T14:12:48.121568,La Nación,“Largala o no jugás más”. La otra leyenda de la AFA: cuando Grondona liberó la fragata Libertad que estuvo 77 días retenida en Ghana,https://www.lanacion.com.ar/lifestyle/largala-o-no-jugas-mas-la-otra-leyenda-de-la-afa-cuando-grondona-libero-la-fragata-libertad-que-nid02032026/
76,2026-03-02T13:22:18.370694,La Nación,El discurso completo de Javier Milei en la apertura de sesiones ordinarias,https://www.lanacion.com.ar/politica/el-discurso-completo-de-javier-milei-en-la-apertura-de-sesiones-ordinarias-nid02032026/
75,2026-03-02T11:39:29.766793,Infobae,"El discurso completo de Milei en el Congreso: reformas, durísimas críticas a la oposición y el futuro económico",https://www.infobae.com/politica/2026/03/02/el-discurso-completo-de-milei-en-el-congreso-reformas-durisimas-criticas-a-la-oposicion-y-el-futuro-economico/
74,2026-03-02T05:38:11.372288,La Nación,"El discurso completo de Javier Milei en el Congreso: gritos, insultos y un anuncio sugestivo que desnuda la ambición de Milei",https://www.lanacion.com.ar/politica/el-discurso-completo-de-javier-milei-en-el-congreso-gritos-insultos-y-un-anuncio-sugestivo-que-nid02032026/
73,2026-03-02T05:38:02.693541,Clarín,El discurso completo de Javier Milei para la apertura de sesiones del Congreso,https://www.clarin.com/politica/discurso-completo-javier-milei-apertura-sesiones-congreso_0_fmf72AUDFu.html
72,2026-03-02T02:26:51.090457,La Nación,"Javier Milei en la Apertura de Sesiones 2026, en vivo: el discurso minuto a minuto",https://www.lanacion.com.ar/politica/javier-milei-en-el-congreso-en-vivo-la-apertura-de-sesiones-2026-minuto-a-minuto-nid01032026/
