id,fecha,medio,titulo,url
352,2026-03-10T23:45:29.887311,Infobae,Daniel Briceño se convirtió en el candidato que ‘rompió el molde’ en las elecciones del 8 de marzo: “Estamos jugando dos visiones de país”,https://www.infobae.com/colombia/2026/03/10/daniel-briceno-se-convirtio-en-el-candidato-que-rompio-el-molde-en-las-elecciones-del-8-de-marzo-estamos-jugando-dos-visiones-de-pais/
351,2026-03-10T23:14:32.645233,El Intransigente,Cristina Pérez confirmó lo que sucede en su relación con Luis Petri: «Hoy»,https://elintransigente.com/2026/03/cristina-perez-confirmo-lo-que-sucede-en-su-relacion-con-luis-petri-hoy/
350,2026-03-10T22:44:39.003316,Infobae,Red de Veedurías puso la lupa sobre el ‘reacomodo de poder’ en ISA tras la salida de Jorge Carrillo de la presidencia,https://www.infobae.com/colombia/2026/03/10/red-de-veedurias-puso-la-lupa-sobre-el-reacomodo-de-poder-en-isa-tras-la-salida-de-jorge-carrillo-de-la-presidencia/
349,2026-03-10T22:44:34.810193,Infobae,Envían a la cárcel a excandidato al Senado por presuntos nexos con ‘Papá Pitufo’: otros cuatro expolicías fueron judicializados,https://www.infobae.com/colombia/2026/03/10/envian-a-la-carcel-a-excandidato-al-senado-por-presuntos-nexos-con-papa-pitufo-otros-cuatros-expolicias-fueron-judicializados/
348,2026-03-10T22:44:25.064335,Infobae,La generación de empleo se vio afectada por la millonaria reducción de la inversión en Colombia desde pandemia: así están las cifras,https://www.infobae.com/colombia/2026/03/10/la-generacion-de-empleo-se-vio-afectada-por-la-millonaria-reduccion-de-la-inversion-en-colombia-desde-pandemia-asi-estan-las-cifras/
347,2026-03-10T22:44:24.183389,Infobae,Nuevo contralor de Bogotá le puso la lupa a las obras de la primera línea del metro: ¿hay riesgos en los plazos y ejecución para 2028?,https://www.infobae.com/colombia/2026/03/10/nuevo-contralor-de-bogota-le-puso-la-lupa-a-las-obras-de-la-primera-linea-del-metro-hay-riesgos-en-los-plazos-y-ejecucion-para-2028/
346,2026-03-10T22:01:50.170621,Infobae,Activista petrista arreció contra Lalis por repostear mensaje que criticaba sus “privilegios”: “Me genera gracia”,https://www.infobae.com/colombia/2026/03/10/activista-petrista-arrecio-contra-lalis-por-repostear-mensaje-que-criticaba-sus-privilegios-me-genera-gracia/
345,2026-03-10T19:23:50.866838,Infobae,Ministro de Salud se despachó contra Cathy Juvinao por decirle “niña de colegio” a Mafe Carrascal: “Podrían darle clases de dignidad”,https://www.infobae.com/colombia/2026/03/10/ministro-de-salud-se-despacho-contra-cathy-juvinao-por-decirle-nina-de-colegio-a-mafe-carrascal-podrian-darle-clases-de-dignidad/
344,2026-03-10T16:42:09.976873,Ámbito,"Con Javier Milei en Estados Unidos, Victoria Villarruel mantiene una reducida agenda al frente del Ejecutivo",https://www.ambito.com/politica/con-javier-milei-estados-unidos-victoria-villarruel-mantiene-una-reducida-agenda-al-frente-del-ejecutivo-n6254307
343,2026-03-10T16:41:37.953768,Infobae,Histórica presentación del argentino Kevin Vallejos en UFC: protagonizará la velada estelar contra el norteamericano Josh Emmett,https://www.infobae.com/deportes/2026/03/10/historica-presentacion-del-argentino-kevin-vallejos-en-ufc-protagonizara-la-velada-estelar-contra-el-norteamericano-josh-emmett/
342,2026-03-10T13:45:49.362933,Infobae,Cathy Juvinao arremetió contra Mafe Carrascal por la ‘quemada’ de algunos senadores en las elecciones: “Se cree cacica y además lo restriega”,https://www.infobae.com/colombia/2026/03/10/cathy-juvinao-arremetio-contra-mafe-carrascal-por-la-quemada-de-algunos-senadores-en-las-elecciones-se-cree-cacica-y-ademas-lo-restriega/
341,2026-03-10T06:08:40.917954,Infobae,Ingrid Betancourt habla de los “quemados” en elecciones y sostiene que Petro también quedó golpeado políticamente,https://www.infobae.com/colombia/2026/03/10/ingrid-betancourt-habla-de-los-quemados-en-elecciones-y-sostiene-que-petro-tambien-quedo-golpeado-politicamente/
340,2026-03-10T02:47:53.533996,Infobae,Paloma Valencia fijó fecha y hora para la inscripción de su candidatura a la Presidencia de Colombia: esto es lo que se sabe,https://www.infobae.com/colombia/2026/03/10/paloma-valencia-fijo-fecha-y-hora-para-la-inscripcion-de-su-candidatura-a-la-presidencia-de-colombia-esto-es-lo-que-se-sabe/
339,2026-03-10T02:47:53.144902,Infobae,La herencia del crimen: así han caído uno a uno los hermanos de ‘Iván Mordisco’ ante la justicia,https://www.infobae.com/colombia/2026/03/10/la-herencia-del-crimen-asi-han-caido-uno-a-uno-los-hermanos-de-ivan-mordisco-ante-la-justicia/
338,2026-03-10T02:47:48.124570,Infobae,Fiesta clandestina durante la ley seca por elecciones del 8 de marzo terminó en balacera: una mujer murió,https://www.infobae.com/colombia/2026/03/10/fiesta-clandestina-durante-la-ley-seca-por-elecciones-del-8-de-marzo-termino-en-balacera-una-mujer-murio/
337,2026-03-10T02:47:47.331390,Infobae,Maluma celebró el segundo cumpleaños de Paris con una fiesta temática marina de ensueño: el mensaje a su hija conmovió,https://www.infobae.com/colombia/2026/03/10/maluma-celebro-el-segundo-cumpleanos-de-paris-con-una-fiesta-tematica-marina-de-ensueno-el-mensaje-a-su-hija-conmovio/
336,2026-03-10T02:47:44.863893,Infobae,El Congreso de 2026 arranca con mínima diversidad política: tendrá solo dos representantes Lgbti+,https://www.infobae.com/colombia/2026/03/10/el-congreso-de-2026-arranca-con-minima-diversidad-politica-tendra-solo-dos-representantes-lgbti/
335,2026-03-10T02:47:44.583148,Infobae,El Invima alertó sobre la comercialización de un popular producto para niños que no cuenta con registro sanitario,https://www.infobae.com/colombia/2026/03/10/el-invima-alerto-sobre-la-comercializacion-de-un-popular-producto-para-ninos-que-no-cuenta-con-registro-sanitario/
334,2026-03-10T02:47:43.987827,Infobae,Apoyos económicos del Sena: así funcionan los beneficios para aprendices de programas técnicos y tecnológicos,https://www.infobae.com/colombia/2026/03/10/apoyos-economicos-del-sena-asi-funcionan-los-beneficios-para-aprendices-de-programas-tecnicos-y-tecnologicos/
333,2026-03-10T02:47:43.573792,Infobae,El Icetex y la Universidad Europea ofrecen 25 becas de hasta el 80% para maestrías virtuales en España: así puede participar,https://www.infobae.com/colombia/2026/03/10/el-icetex-y-la-universidad-europea-ofrecen-25-becas-de-hasta-el-80-para-maestrias-virtuales-en-espana-asi-puede-participar/
332,2026-03-10T02:47:40.139927,Infobae,"James Rodríguez ya le puso fecha a su debut con el Minnesota United, al que llegó para preparar la Copa del Mundo que jugará con Colombia",https://www.infobae.com/colombia/2026/03/10/james-rodriguez-ya-le-puso-fecha-a-su-debut-con-el-minnesota-united-al-que-llego-para-preparar-la-copa-del-mundo-que-jugara-con-colombia/
