id,fecha,medio,titulo,url
23,2026-02-25T18:43:48.480805,Clarín,Hallazgo científico en Argentina: el dinosaurio del tamaño de un gallo que reescribe la historia evolutiva,https://www.clarin.com/sociedad/hallazgo-cientifico-argentina-dinosaurio-tamano-gallo-reescribe-historia-evolutiva_0_zbF8FVq9wD.html
22,2026-02-25T16:38:18.015574,La Nación,El Gobierno paga US$ 33 millones a Estados Unidos para la instrucción a los pilotos de los F-16 comprados a Dinamarca,https://www.lanacion.com.ar/politica/el-gobierno-paga-us-33-millones-a-estados-unidos-para-la-instruccion-a-los-pilotos-de-los-f-16-nid25022026/
21,2026-02-25T16:38:12.933767,La Nación,"Javier Milei, en vivo: las últimas medidas del Gobierno",https://www.lanacion.com.ar/politica/javier-milei-en-vivo-las-ultimas-medidas-del-gobierno-nid25022026/
20,2026-02-25T11:11:46.070084,Ámbito,Ya es oficial: la Argentina pagará u$s33 millones a EEUU para entrenar a los pilotos de F-16,https://www.ambito.com/politica/ya-es-oficial-la-argentina-pagara-us33-millones-eeuu-entrenar-los-pilotos-f-16-n6249201
19,2026-02-25T10:11:30.267566,Infobae,Declaración de Roy Barreras genera tensión en la izquierda tras críticas sobre “perseguir presidentes”,https://www.infobae.com/colombia/2026/02/25/declaracion-de-roy-barreras-genera-tension-en-la-izquierda-tras-criticas-sobre-perseguir-presidentes/
