id,fecha,medio,titulo,url
236,2026-03-05T12:28:59.882524,Infobae,"La Ligue D' Égalité en Camerún, proyecto de la Fundación LaLiga, finaliza su quinta edición",https://www.infobae.com/america/agencias/2026/03/05/la-ligue-d-egalite-en-camerun-proyecto-de-la-fundacion-laliga-finaliza-su-quinta-edicion/
235,2026-03-05T06:01:14.216213,Infobae,La tensión con la industria y las internas copan la agenda frente al descanso del Congreso,https://www.infobae.com/politica/2026/03/05/la-tension-con-la-industria-y-las-internas-copan-la-agenda-frente-al-descanso-del-congreso/
234,2026-03-05T05:03:52.298186,La Nación,El Gobierno oficializó la designación de Juan Bautista Mahiques como ministro de Justicia,https://www.lanacion.com.ar/politica/el-gobierno-oficializo-la-designacion-de-juan-bautista-mahiques-como-ministro-de-justicia-nid05032026/
233,2026-03-05T05:03:51.165624,La Nación,"Javier Milei, en vivo: las últimas medidas del Gobierno",https://www.lanacion.com.ar/politica/javier-milei-en-vivo-las-ultimas-medidas-del-gobierno-nid05032026/
232,2026-03-05T03:33:31.824499,La Nación,La esposa de Nahuel Gallo criticó sin dar nombres a quienes dicen que participaron de la liberación,https://www.lanacion.com.ar/politica/la-esposa-de-nahuel-gallo-critico-sin-dar-nombres-a-quienes-dicen-que-participaron-de-la-liberacion-nid04032026/
231,2026-03-05T03:33:10.429599,La Nación,Los pasadizos secretos detrás del recambio en Justicia,https://www.lanacion.com.ar/politica/los-pasadizos-secretos-detras-del-recambio-en-justicia-nid05032026/
230,2026-03-05T03:33:06.042109,La Nación,La nueva geografía del poder que anticiparon los palcos VIP en el Congreso,https://www.lanacion.com.ar/politica/la-nueva-geografia-del-poder-que-anticiparon-los-palcos-vip-en-el-congreso-nid05032026/
229,2026-03-05T00:56:56.790652,La Nación,Mahiques se otorgó licencia a sí mismo como fiscal general porteño para ser ministro de Justicia de Milei,https://www.lanacion.com.ar/politica/mahiques-se-otorgo-licencia-a-si-mismo-como-fiscal-general-porteno-para-ser-ministro-de-justicia-de-nid04032026/
228,2026-03-05T00:56:56.420078,La Nación,Cúneo Libarona habló sobre el desembarco de Mahiques y Viola en Justicia y reveló sus planes tras dejar el Gobierno,https://www.lanacion.com.ar/politica/cuneo-libarona-hablo-sobre-el-desembarco-de-mahiques-y-viola-en-justicia-y-revelo-sus-planes-tras-nid04032026/
